{
  "schema_version": 1,
  "report_id": "pilot-example-20260817",
  "build_fingerprints": {
    "cli": {
      "version": "7.2.134",
      "sha256": "aaaaaaaaaaaaaaaaaaaaaaaaaaaaaaaaaaaaaaaaaaaaaaaaaaaaaaaaaaaaaaaa",
      "arch": "linux-amd64"
    },
    "plugin": {
      "version": "0.1.0",
      "sha256": "bbbbbbbbbbbbbbbbbbbbbbbbbbbbbbbbbbbbbbbbbbbbbbbbbbbbbbbbbbbbbbbb",
      "abi": 1,
      "rpc": 3
    },
    "panel": {
      "version": "v0.1.0",
      "sha256": "cccccccccccccccccccccccccccccccccccccccccccccccccccccccccccccccc"
    },
    "verifier_schema": 1
  },
  "configuration": {
    "initial_generation": 40,
    "initial_digest": "dddddddddddddddddddddddddddddddddddddddddddddddddddddddddddddddd",
    "model_allowlist": ["pilot-low-risk-model"],
    "priority": -100,
    "lower_priority_normalizer_audit": {
      "performed": true,
      "enabled_lower_priority_count": 0,
      "evidence_ref": "sanitized-normalizer-priority-audit-001"
    },
    "headroom_security": {
      "listen_addresses": ["127.0.0.1:8787"],
      "public_egress_default_denied": true,
      "telemetry_disabled": true,
      "raw_prompt_logging_disabled": true
    }
  },
  "stages": [
    {
      "name": "baseline_all_off",
      "window_start": "2026-08-17T01:00:00Z",
      "window_end": "2026-08-17T01:15:00Z",
      "sample_size": 12,
      "enabled_stages": [],
      "config_generation": 41,
      "config_digest": "eeeeeeeeeeeeeeeeeeeeeeeeeeeeeeeeeeeeeeeeeeeeeeeeeeeeeeeeeeeeeeee",
      "provider_usage": {
        "available": true,
        "metric": "provider_reported_input_tokens",
        "input_tokens_before": 24000,
        "input_tokens_after": 24000
      },
      "byte_measurements": { "input_bytes": 96000, "output_bytes": 96000 },
      "resources": {
        "plugin_rss_delta_mib": 8.2,
        "headroom_max_inflight": 0,
        "host_available_memory_mib": 410,
        "swap_in_delta_mib": 0
      },
      "behavior_quality": {
        "fixed_tasks": 10,
        "critical_failures": 0,
        "code_truncations": 0,
        "tool_behavior_regressions": 0
      },
      "baseline_byte_identical_count": 12,
      "headroom_call_count": 0,
      "technical_red_lines": {
        "plugin_5xx": false,
        "provider_400_or_422": false,
        "structure_error": false,
        "tool_pairing_error": false,
        "sse_error": false,
        "duplicate_prompt_marker": false,
        "critical_task_failure": false,
        "headroom_timeout_or_saturation": false,
        "oom_or_service_restart": false,
        "new_persistent_swap_in": false
      },
      "result": "pass"
    },
    {
      "name": "rtk",
      "window_start": "2026-08-17T01:20:00Z",
      "window_end": "2026-08-17T01:35:00Z",
      "sample_size": 12,
      "enabled_stages": ["rtk"],
      "config_generation": 42,
      "config_digest": "ffffffffffffffffffffffffffffffffffffffffffffffffffffffffffffffff",
      "provider_usage": {
        "available": true,
        "metric": "provider_reported_input_tokens",
        "input_tokens_before": 24200,
        "input_tokens_after": 19800
      },
      "byte_measurements": { "input_bytes": 96800, "output_bytes": 79200 },
      "resources": {
        "plugin_rss_delta_mib": 8.6,
        "headroom_max_inflight": 0,
        "host_available_memory_mib": 405,
        "swap_in_delta_mib": 0
      },
      "behavior_quality": {
        "fixed_tasks": 10,
        "critical_failures": 0,
        "code_truncations": 0,
        "tool_behavior_regressions": 0
      },
      "baseline_byte_identical_count": null,
      "headroom_call_count": 0,
      "technical_red_lines": {
        "plugin_5xx": false,
        "provider_400_or_422": false,
        "structure_error": false,
        "tool_pairing_error": false,
        "sse_error": false,
        "duplicate_prompt_marker": false,
        "critical_task_failure": false,
        "headroom_timeout_or_saturation": false,
        "oom_or_service_restart": false,
        "new_persistent_swap_in": false
      },
      "result": "pass"
    },
    {
      "name": "headroom",
      "window_start": "2026-08-17T01:40:00Z",
      "window_end": "2026-08-17T01:55:00Z",
      "sample_size": 12,
      "enabled_stages": ["rtk", "headroom"],
      "config_generation": 43,
      "config_digest": "0123456789abcdef0123456789abcdef0123456789abcdef0123456789abcdef",
      "provider_usage": {
        "available": true,
        "metric": "provider_reported_input_tokens",
        "input_tokens_before": 24100,
        "input_tokens_after": 17100
      },
      "byte_measurements": { "input_bytes": 96400, "output_bytes": 68400 },
      "resources": {
        "plugin_rss_delta_mib": 9.1,
        "headroom_max_inflight": 1,
        "host_available_memory_mib": 397,
        "swap_in_delta_mib": 0
      },
      "behavior_quality": {
        "fixed_tasks": 10,
        "critical_failures": 0,
        "code_truncations": 0,
        "tool_behavior_regressions": 0
      },
      "baseline_byte_identical_count": null,
      "headroom_call_count": 12,
      "technical_red_lines": {
        "plugin_5xx": false,
        "provider_400_or_422": false,
        "structure_error": false,
        "tool_pairing_error": false,
        "sse_error": false,
        "duplicate_prompt_marker": false,
        "critical_task_failure": false,
        "headroom_timeout_or_saturation": false,
        "oom_or_service_restart": false,
        "new_persistent_swap_in": false
      },
      "result": "pass"
    },
    {
      "name": "caveman_lite",
      "window_start": "2026-08-17T02:00:00Z",
      "window_end": "2026-08-17T02:15:00Z",
      "sample_size": 12,
      "enabled_stages": ["rtk", "headroom", "caveman:lite"],
      "config_generation": 44,
      "config_digest": "123456789abcdef0123456789abcdef0123456789abcdef0123456789abcdef0",
      "provider_usage": {
        "available": true,
        "metric": "provider_reported_input_tokens",
        "input_tokens_before": 24300,
        "input_tokens_after": 17500
      },
      "byte_measurements": { "input_bytes": 97200, "output_bytes": 70000 },
      "resources": {
        "plugin_rss_delta_mib": 9.4,
        "headroom_max_inflight": 1,
        "host_available_memory_mib": 393,
        "swap_in_delta_mib": 0
      },
      "behavior_quality": {
        "fixed_tasks": 10,
        "critical_failures": 0,
        "code_truncations": 0,
        "tool_behavior_regressions": 0
      },
      "baseline_byte_identical_count": null,
      "headroom_call_count": 12,
      "technical_red_lines": {
        "plugin_5xx": false,
        "provider_400_or_422": false,
        "structure_error": false,
        "tool_pairing_error": false,
        "sse_error": false,
        "duplicate_prompt_marker": false,
        "critical_task_failure": false,
        "headroom_timeout_or_saturation": false,
        "oom_or_service_restart": false,
        "new_persistent_swap_in": false
      },
      "result": "pass"
    },
    {
      "name": "ponytail_lite",
      "window_start": "2026-08-17T02:20:00Z",
      "window_end": "2026-08-17T02:35:00Z",
      "sample_size": 12,
      "enabled_stages": ["rtk", "headroom", "caveman:lite", "ponytail:lite"],
      "config_generation": 45,
      "config_digest": "23456789abcdef0123456789abcdef0123456789abcdef0123456789abcdef01",
      "provider_usage": {
        "available": true,
        "metric": "provider_reported_input_tokens",
        "input_tokens_before": 24500,
        "input_tokens_after": 17800
      },
      "byte_measurements": { "input_bytes": 98000, "output_bytes": 71200 },
      "resources": {
        "plugin_rss_delta_mib": 9.6,
        "headroom_max_inflight": 1,
        "host_available_memory_mib": 390,
        "swap_in_delta_mib": 0
      },
      "behavior_quality": {
        "fixed_tasks": 10,
        "critical_failures": 0,
        "code_truncations": 0,
        "tool_behavior_regressions": 0
      },
      "baseline_byte_identical_count": null,
      "headroom_call_count": 12,
      "technical_red_lines": {
        "plugin_5xx": false,
        "provider_400_or_422": false,
        "structure_error": false,
        "tool_pairing_error": false,
        "sse_error": false,
        "duplicate_prompt_marker": false,
        "critical_task_failure": false,
        "headroom_timeout_or_saturation": false,
        "oom_or_service_restart": false,
        "new_persistent_swap_in": false
      },
      "result": "pass"
    }
  ],
  "stop_drill": {
    "trigger": "rehearsed-technical-red-line",
    "disabled_at": "2026-08-17T02:40:00Z",
    "confirmed_at": "2026-08-17T02:40:18Z",
    "confirmation_seconds": 18,
    "confirmed_generation": 46,
    "confirmed_digest": "3456789abcdef0123456789abcdef0123456789abcdef0123456789abcdef012",
    "pipeline": "all_bypassed",
    "old_generation_inflight_zero": true,
    "byte_identical_fixture": true,
    "headroom_calls_after_disable": 0
  },
  "privacy_attestation": {
    "contains_production_prompt": false,
    "contains_api_key": false,
    "contains_management_credential": false,
    "contains_raw_request_or_response": false
  },
  "decision": "minimum_pilot_passed"
}
